{
  "accepted": false,
  "accepted_at": "",
  "accepted_by": "",
  "artifact_retention_days": 90,
  "credential_review": {
    "reviewed_at": "",
    "reviewed_by": "",
    "scope": "release signing, notarization, publication, support, and vulnerability intake credentials",
    "status": "pending"
  },
  "log_retention_days": 30,
  "notes": [
    "Example only. Replace with accepted release-operations evidence before moving to docs/release-ops/<version>.json."
  ],
  "release_credentials_owner": "",
  "schema": "kiana.release-ops.v1",
  "security_contact": "",
  "status": "blocked",
  "support_contact": "",
  "version": "0.1.0",
  "vulnerability_report_channel": ""
}
